;Ticker;Name;Sector;Industry
178;NUE;NUCOR CORPORATION COMMON STOCK;BASIC INDUSTRIES;STEEL/IRON ORE
767;NUS;NU SKIN ENTERPRISES INC. COMMON STOCK;HEALTH CARE;OTHER PHARMACEUTICALS
820;NUV;NUVEEN MUNICIPAL VALUE FUND INC. COMMON STOCK;FINANCE;TRUSTS EXCEPT EDUCATIONAL RELIGIOUS AND CHARITABLE
860;NUVB;NUVATION BIO INC. CLASS A COMMON STOCK;HEALTH CARE;MAJOR PHARMACEUTICALS
142;NVDA;NVIDIA CORPORATION;;
672;NVG;NUVEEN AMT-FREE MUNICIPAL CREDIT INCOME FUND ;FINANCE;INVESTMENT MANAGERS
275;NVR;NVR INC. COMMON STOCK;CAPITAL GOODS;HOMEBUILDING
508;NVRO;NEVRO CORP. COMMON STOCK;HEALTH CARE;BIOTECHNOLOGY: ELECTROMEDICAL & ELECTROTHERAPEUTIC APPARATUS
476;NVTA;INVITAE CORPORATION COMMON STOCK;HEALTH CARE;MEDICAL SPECIALITIES
143;NYCB;NEW YORK COMMUNITY BANCORP, INC.;;
566;NYCB;NEW YORK COMMUNITY BANCORP INC. COMMON STOCK;FINANCE;BANKS
468;NYT;NEW YORK TIMES COMPANY (THE) COMMON STOCK;CONSUMER SERVICES;NEWSPAPERS/MAGAZINES
814;NZF;NUVEEN MUNICIPAL CREDIT INCOME FUND ;FINANCE;FINANCE COMPANIES
208;O;REALTY INCOME CORPORATION COMMON STOCK;CONSUMER SERVICES;REAL ESTATE INVESTMENT TRUSTS
378;OC;OWENS CORNING INC COMMON STOCK NEW;BASIC INDUSTRIES;BUILDING MATERIALS
733;OFC;CORPORATE OFFICE PROPERTIES TRUST COMMON STOCK;CONSUMER SERVICES;REAL ESTATE INVESTMENT TRUSTS
482;OGE;OGE ENERGY CORP COMMON STOCK;PUBLIC UTILITIES;ELECTRIC UTILITIES: CENTRAL
425;OHI;OMEGA HEALTHCARE INVESTORS INC. COMMON STOCK;CONSUMER SERVICES;REAL ESTATE INVESTMENT TRUSTS
804;OI;O-I GLASS INC. COMMON STOCK;CONSUMER DURABLES;CONTAINERS/PACKAGING
209;OKE;ONEOK INC. COMMON STOCK;PUBLIC UTILITIES;OIL & GAS PRODUCTION
456;OLN;OLIN CORPORATION COMMON STOCK;BASIC INDUSTRIES;SPECIALTY CHEMICALS
278;OMC;OMNICOM GROUP INC. COMMON STOCK;TECHNOLOGY;ADVERTISING
738;OMI;OWENS & MINOR INC. COMMON STOCK;HEALTH CARE;MEDICAL SPECIALITIES
692;ONTO;ONTO INNOVATION INC. COMMON STOCK;TECHNOLOGY;SEMICONDUCTORS
144;OPEN;OPENDOOR TECHNOLOGIES INC.;;
666;ORA;ORMAT TECHNOLOGIES INC. COMMON STOCK;PUBLIC UTILITIES;ELECTRIC UTILITIES: CENTRAL
145;ORCL;ORACLE CORPORATION;;
15;ORCL;ORACLE CORPORATION COMMON STOCK;TECHNOLOGY;COMPUTER SOFTWARE: PREPACKAGED SOFTWARE
451;ORI;OLD REPUBLIC INTERNATIONAL CORPORATION COMMON STOCK;FINANCE;SPECIALTY INSURERS
305;OSH;OAK STREET HEALTH INC. COMMON STOCK;HEALTH CARE;ASSISTED LIVING SERVICES
428;OSK;OSHKOSH CORPORATION (HOLDING COMPANY)COMMON STOCK;CAPITAL GOODS;AUTO MANUFACTURING
862;OUST;OUSTER INC. COMMON STOCK;CAPITAL GOODS;INDUSTRIAL MACHINERY/COMPONENTS
173;OXY;OCCIDENTAL PETROLEUM CORPORATION COMMON STOCK;ENERGY;OIL & GAS PRODUCTION
146;OXY;OCCIDENTAL PETROLEUM CORPORATION;;
523;PAG;PENSKE AUTOMOTIVE GROUP INC. COMMON STOCK;CONSUMER SERVICES;OTHER SPECIALTY STORES
147;PAGS;PAGSEGURO DIGITAL LTD.;;
142;PANW;PALO ALTO NETWORKS INC. COMMON STOCK;TECHNOLOGY;EDP SERVICES
483;PB;PROSPERITY BANCSHARES INC. COMMON STOCK;FINANCE;MAJOR BANKS
798;PBH;PRESTIGE CONSUMER HEALTHCARE INC. COMMON STOCK;HEALTH CARE;MAJOR PHARMACEUTICALS
148;PBR;PETR¢LEO BRASILEIRO S.A. - PETROBRAS;;
149;PBR-A;PETR¢LEO BRASILEIRO S.A. - PETROBRAS;;
247;PCG;PACIFIC GAS & ELECTRIC CO. COMMON STOCK;PUBLIC UTILITIES;POWER GENERATION
150;PCG;PG&E CORPORATION;;
151;PDD;PINDUODUO INC.;;
879;PDI;PIMCO DYNAMIC INCOME FUND COMMON STOCK;FINANCE;TRUSTS EXCEPT EDUCATIONAL RELIGIOUS AND CHARITABLE
826;PDM;PIEDMONT OFFICE REALTY TRUST INC. CLASS A COMMON STOCK;CONSUMER SERVICES;BUILDING OPERATORS
268;PEAK;HEALTHPEAK PROPERTIES INC. COMMON STOCK;CONSUMER SERVICES;REAL ESTATE INVESTMENT TRUSTS
152;PEAK;HEALTHPEAK PROPERTIES, INC.;;
737;PEB;PEBBLEBROOK HOTEL TRUST COMMON SHARES OF BENEFICIAL INTEREST;CONSUMER SERVICES;REAL ESTATE INVESTMENT TRUSTS
172;PEG;PUBLIC SERVICE ENTERPRISE GROUP INCORPORATED COMMON STOCK;PUBLIC UTILITIES;ELECTRIC UTILITIES: CENTRAL
153;PENN;PENN NATIONAL GAMING, INC.;;
154;PFE;PFIZER INC.;;
14;PFE;PFIZER INC. COMMON STOCK;HEALTH CARE;MAJOR PHARMACEUTICALS
491;PFGC;PERFORMANCE FOOD GROUP COMPANY COMMON STOCK;CONSUMER NON-DURABLES;FOOD DISTRIBUTORS
630;PFSI;PENNYMAC FINANCIAL SERVICES INC. COMMON STOCK;FINANCE;FINANCE: CONSUMER SERVICES
8;PG;PROCTER & GAMBLE COMPANY (THE) COMMON STOCK;CONSUMER NON-DURABLES;PACKAGE GOODS/COSMETICS
155;PG;THE PROCTER & GAMBLE COMPANY;;
98;PGR;PROGRESSIVE CORPORATION (THE) COMMON STOCK;FINANCE;PROPERTY-CASUALTY INSURERS
837;PGRE;PARAMOUNT GROUP INC. COMMON STOCK;CONSUMER SERVICES;REAL ESTATE INVESTMENT TRUSTS
136;PH;PARKER-HANNIFIN CORPORATION COMMON STOCK;CAPITAL GOODS;OFFICE EQUIPMENT/SUPPLIES/SERVICES
312;PHM;PULTEGROUP INC. COMMON STOCK;;
753;PHR;PHREESIA INC. COMMON STOCK;HEALTH CARE;MANAGED HEALTH CARE
436;PII;POLARIS INC. COMMON STOCK;CONSUMER NON-DURABLES;RECREATIONAL PRODUCTS/TOYS
756;PJT;PJT PARTNERS INC. CLASS A COMMON STOCK;FINANCE;INVESTMENT MANAGERS
570;PK;PARK HOTELS & RESORTS INC. COMMON STOCK ;CONSUMER SERVICES;REAL ESTATE INVESTMENT TRUSTS
337;PKG;PACKAGING CORPORATION OF AMERICA COMMON STOCK;BASIC INDUSTRIES;PAPER
281;PKI;PERKINELMER INC. COMMON STOCK;HEALTH CARE;MEDICAL SPECIALITIES
438;PLAN;ANAPLAN INC. COMMON STOCK;TECHNOLOGY;COMPUTER SOFTWARE: PREPACKAGED SOFTWARE
59;PLD;PROLOGIS INC. COMMON STOCK;CONSUMER SERVICES;REAL ESTATE INVESTMENT TRUSTS
488;PLNT;PLANET FITNESS INC. COMMON STOCK;CONSUMER SERVICES;OTHER CONSUMER SERVICES
156;PLTR;PALANTIR TECHNOLOGIES INC.;;
157;PLUG;PLUG POWER INC.;;
29;PM;PHILIP MORRIS INTERNATIONAL INC COMMON STOCK;CONSUMER NON-DURABLES;FARMING/SEEDS/MILLING
867;PMT;PENNYMAC MORTGAGE INVESTMENT TRUST COMMON SHARES OF BENEFICIAL INTEREST;CONSUMER SERVICES;REAL ESTATE INVESTMENT TRUSTS
69;PNC;PNC FINANCIAL SERVICES GROUP INC. (THE) COMMON STOCK;FINANCE;MAJOR BANKS
639;PNM;PNM RESOURCES INC. (HOLDING CO.) COMMON STOCK;PUBLIC UTILITIES;ELECTRIC UTILITIES: CENTRAL
407;PNW;PINNACLE WEST CAPITAL CORPORATION COMMON STOCK;PUBLIC UTILITIES;ELECTRIC UTILITIES: CENTRAL
636;POR;PORTLAND GENERAL ELECTRIC CO COMMON STOCK;PUBLIC UTILITIES;ELECTRIC UTILITIES: CENTRAL
474;POST;POST HOLDINGS INC. COMMON STOCK;CONSUMER NON-DURABLES;SPECIALTY FOODS
130;PPG;PPG INDUSTRIES INC. COMMON STOCK;BASIC INDUSTRIES;PAINTS/COATINGS
224;PPL;PPL CORPORATION COMMON STOCK;PUBLIC UTILITIES;ELECTRIC UTILITIES: CENTRAL
856;PQG;PQ GROUP HOLDINGS INC. COMMON STOCK;BASIC INDUSTRIES;MAJOR CHEMICALS
715;PRG;PROG HOLDINGS INC. COMMON STOCK;TECHNOLOGY;DIVERSIFIED COMMERCIAL SERVICES
509;PRGO;PERRIGO COMPANY PLC ORDINARY SHARES;HEALTH CARE;MAJOR PHARMACEUTICALS
528;PRI;PRIMERICA INC. COMMON STOCK;FINANCE;LIFE INSURANCE
799;PRLB;PROTO LABS INC. COMMON STOCK;CAPITAL GOODS;OFFICE EQUIPMENT/SUPPLIES/SERVICES
857;PRO;PROS HOLDINGS INC. COMMON STOCK;TECHNOLOGY;EDP SERVICES
129;PRU;PRUDENTIAL FINANCIAL INC. COMMON STOCK;FINANCE;LIFE INSURANCE
102;PSA;PUBLIC STORAGE COMMON STOCK;CONSUMER SERVICES;REAL ESTATE INVESTMENT TRUSTS
637;PSB;PS BUSINESS PARKS INC. (MD) COMMON STOCK;CONSUMER SERVICES;REAL ESTATE INVESTMENT TRUSTS
158;PSFE;PAYSAFE LIMITED;;
134;PSX;PHILLIPS 66 COMMON STOCK;ENERGY;INTEGRATED OIL COMPANIES
404;PSXP;PHILLIPS 66 PARTNERS LP COMMON UNITS REPRESENTING LIMITED PARTNER INTEREST IN THE PARTNERSHIP;ENERGY;OIL & GAS PRODUCTION
846;PTY;PIMCO CORPORATE & INCOME OPPORTUNITY FUND;FINANCE;INVESTMENT MANAGERS
449;PVH;PVH CORP. COMMON STOCK;;
332;PWR;QUANTA SERVICES INC. COMMON STOCK;CAPITAL GOODS;ENGINEERING & CONSTRUCTION
131;PXD;PIONEER NATURAL RESOURCES COMPANY COMMON STOCK;ENERGY;OIL & GAS PRODUCTION
159;PYPL;PAYPAL HOLDINGS, INC.;;
160;QCOM;QUALCOMM INCORPORATED;;
357;QS;QUANTUMSCAPE CORPORATION CLASS A COMMON STOCK;CAPITAL GOODS;AUTO PARTS:O.E.M.
562;QTS;QTS REALTY TRUST INC. CLASS A COMMON STOCK;CONSUMER SERVICES;REAL ESTATE INVESTMENT TRUSTS
655;R;RYDER SYSTEM INC. COMMON STOCK;MISCELLANEOUS;RENTAL/LEASING COMPANIES
721;RAMP;LIVERAMP HOLDINGS INC. COMMON STOCK;TECHNOLOGY;EDP SERVICES
558;RBC;REGAL BELOIT CORPORATION COMMON STOCK;CONSUMER DURABLES;METAL FABRICATIONS
161;RBLX;ROBLOX CORPORATION;;
219;RCL;D/B/A ROYAL CARIBBEAN CRUISES LTD. COMMON STOCK;;
615;RDN;RADIAN GROUP INC. COMMON STOCK;FINANCE;PROPERTY-CASUALTY INSURERS
162;RDS-A;ROYAL DUTCH SHELL PLC;;
444;REXR;REXFORD INDUSTRIAL REALTY INC. COMMON STOCK;CONSUMER SERVICES;REAL ESTATE INVESTMENT TRUSTS
163;RF;REGIONS FINANCIAL CORPORATION;;
251;RF;REGIONS FINANCIAL CORPORATION COMMON STOCK;FINANCE;MAJOR BANKS
440;RGA;REINSURANCE GROUP OF AMERICA INCORPORATED COMMON STOCK;FINANCE;LIFE INSURANCE
310;RH;RH COMMON STOCK;CONSUMER SERVICES;OTHER SPECIALTY STORES
380;RHI;ROBERT HALF INTERNATIONAL INC. COMMON STOCK;TECHNOLOGY;DIVERSIFIED COMMERCIAL SERVICES
602;RHP;RYMAN HOSPITALITY PROPERTIES INC. (REIT);CONSUMER SERVICES;REAL ESTATE INVESTMENT TRUSTS
164;RIG;TRANSOCEAN LTD.;;
165;RIOT;RIOT BLOCKCHAIN, INC.;;
271;RJF;RAYMOND JAMES FINANCIAL INC. COMMON STOCK;FINANCE;INVESTMENT BANKERS/BROKERS/SERVICE
783;RKT;ROCKET COMPANIES INC. CLASS A COMMON STOCK;FINANCE;FINANCE: CONSUMER SERVICES
166;RKT;ROCKET COMPANIES, INC.;;
420;RL;RALPH LAUREN CORPORATION COMMON STOCK;CONSUMER NON-DURABLES;APPAREL
869;RLGY;REALOGY HOLDINGS CORP. COMMON STOCK;FINANCE;REAL ESTATE
595;RLI;RLI CORP. COMMON STOCK (DE);FINANCE;PROPERTY-CASUALTY INSURERS
805;RLJ;RLJ LODGING TRUST COMMON SHARES OF BENEFICIAL INTEREST $0.01 PAR VALUE;CONSUMER SERVICES;REAL ESTATE INVESTMENT TRUSTS
167;RLLCF;ROLLS-ROYCE HOLDINGS PLC;;
168;RLX;RLX TECHNOLOGY INC.;;
145;RMD;RESMED INC. COMMON STOCK;HEALTH CARE;MEDICAL/DENTAL INSTRUMENTS
682;ROG;ROGERS CORPORATION COMMON STOCK;CAPITAL GOODS;INDUSTRIAL MACHINERY/COMPONENTS
158;ROK;ROCKWELL AUTOMATION INC. COMMON STOCK;CAPITAL GOODS;INDUSTRIAL MACHINERY/COMPONENTS
285;ROL;ROLLINS INC. COMMON STOCK;TECHNOLOGY;INDUSTRIAL SPECIALTIES
110;ROP;ROPER TECHNOLOGIES INC. COMMON STOCK;CAPITAL GOODS;INDUSTRIAL MACHINERY/COMPONENTS
812;RPAI;RETAIL PROPERTIES OF AMERICA INC. CLASS A COMMON STOCK;CONSUMER SERVICES;REAL ESTATE INVESTMENT TRUSTS
359;RPM;RPM INTERNATIONAL INC. COMMON STOCK;BASIC INDUSTRIES;PAINTS/COATINGS
866;RQI;COHEN & STEERS QUALITY INCOME REALTY FUND INC COMMON SHARES;FINANCE;TRUSTS EXCEPT EDUCATIONAL RELIGIOUS AND CHARITABLE
650;RRC;RANGE RESOURCES CORPORATION COMMON STOCK;ENERGY;OIL & GAS PRODUCTION
169;RRC;RANGE RESOURCES CORPORATION;;
390;RS;RELIANCE STEEL & ALUMINUM CO. COMMON STOCK (DE);BASIC INDUSTRIES;STEEL/IRON ORE
153;RSG;REPUBLIC SERVICES INC. COMMON STOCK;PUBLIC UTILITIES;ENVIRONMENTAL SERVICES
40;RTX;RAYTHEON TECHNOLOGIES CORPORATION COMMON STOCK;CAPITAL GOODS;AEROSPACE
170;RUN;SUNRUN INC.;;
530;RXN;REXNORD CORPORATION COMMON STOCK;TECHNOLOGY;INDUSTRIAL MACHINERY/COMPONENTS
584;RYN;RAYONIER INC. REIT COMMON STOCK;CONSUMER SERVICES;REAL ESTATE INVESTMENT TRUSTS
624;SAFE;SAFEHOLD INC. COMMON STOCK;CONSUMER SERVICES;REAL ESTATE INVESTMENT TRUSTS
585;SAIL;SAILPOINT TECHNOLOGIES HOLDINGS INC. COMMON STOCK;TECHNOLOGY;COMPUTER SOFTWARE: PREPACKAGED SOFTWARE
340;SAM;BOSTON BEER COMPANY INC. (THE) COMMON STOCK;CONSUMER NON-DURABLES;BEVERAGES (PRODUCTION/DISTRIBUTION)
171;SAN;BANCO SANTANDER, S.A.;;
690;SAVE;SPIRIT AIRLINES INC. COMMON STOCK;TRANSPORTATION;AIR FREIGHT/DELIVERY SERVICES
172;SAVE;SPIRIT AIRLINES, INC.;;
808;SBH;SALLY BEAUTY HOLDINGS INC. (NAME TO BE CHANGED FROM SALLY HOLDINGS INC.) COMMON STOCK;MISCELLANEOUS;DIVERSIFIED COMMERCIAL SERVICES
173;SBUX;STARBUCKS CORPORATION;;
109;SCCO;SOUTHERN COPPER CORPORATION COMMON STOCK;BASIC INDUSTRIES;PRECIOUS METALS
174;SCHW;THE CHARLES SCHWAB CORPORATION;;
36;SCHW;CHARLES SCHWAB CORPORATION (THE) COMMON STOCK;FINANCE;INVESTMENT BANKERS/BROKERS/SERVICE
421;SCI;SERVICE CORPORATION INTERNATIONAL COMMON STOCK;MISCELLANEOUS;OTHER CONSUMER SERVICES
778;SCL;STEPAN COMPANY COMMON STOCK;CONSUMER NON-DURABLES;PACKAGE GOODS/COSMETICS
175;SDC;SMILEDIRECTCLUB, INC.;;
30;SE;SEA LIMITED AMERICAN DEPOSITARY SHARES EACH REPRESENTING ONE CLASS A ORDINARY SHARE;TECHNOLOGY;COMPUTER SOFTWARE: PREPACKAGED SOFTWARE
626;SEAS;SEAWORLD ENTERTAINMENT INC. COMMON STOCK;CONSUMER SERVICES;MOVIES/ENTERTAINMENT
419;SEE;SEALED AIR CORPORATION COMMON STOCK;BASIC INDUSTRIES;CONTAINERS/PACKAGING
534;SEM;SELECT MEDICAL HOLDINGS CORPORATION COMMON STOCK;HEALTH CARE;HOSPITAL/NURSING MANAGEMENT
478;SF;STIFEL FINANCIAL CORPORATION COMMON STOCK;FINANCE;INVESTMENT BANKERS/BROKERS/SERVICE
674;SFBS;SERVISFIRST BANCSHARES INC. COMMON STOCK;FINANCE;MAJOR BANKS
607;SHAK;SHAKE SHACK INC. CLASS A COMMON STOCK;CONSUMER SERVICES;RESTAURANTS
529;SHLX;SHELL MIDSTREAM PARTNERS L.P. COMMON UNITS REPRESENTING LIMITED PARTNER INTERESTS;ENERGY;OILFIELD SERVICES/EQUIPMENT
774;SHO;SUNSTONE HOTEL INVESTORS INC. SUNSTONE HOTEL INVESTORS INC. COMMON SHARES;CONSUMER SERVICES;REAL ESTATE INVESTMENT TRUSTS
73;SHW;SHERWIN-WILLIAMS COMPANY (THE) COMMON STOCK;BASIC INDUSTRIES;PAINTS/COATINGS
775;SI;SILVERGATE CAPITAL CORPORATION CLASS A COMMON STOCK;FINANCE;MAJOR BANKS
176;SIRI;SIRIUS XM HOLDINGS INC.;;
736;SITC;SITE CENTERS CORP. COMMON STOCK;CONSUMER SERVICES;REAL ESTATE INVESTMENT TRUSTS
457;SITE;SITEONE LANDSCAPE SUPPLY INC. COMMON STOCK;;
673;SIX;SIX FLAGS ENTERTAINMENT CORPORATION NEW COMMON STOCK;CONSUMER SERVICES;MOVIES/ENTERTAINMENT
751;SJI;SOUTH JERSEY INDUSTRIES INC. COMMON STOCK;PUBLIC UTILITIES;OIL/GAS TRANSMISSION
315;SJM;J.M. SMUCKER COMPANY (THE) NEW COMMON STOCK;CONSUMER NON-DURABLES;PACKAGED FOODS
177;SKLZ;SKILLZ INC.;;
455;SKX;SKECHERS U.S.A. INC. COMMON STOCK;CONSUMER NON-DURABLES;SHOE MANUFACTURING
757;SKY;SKYLINE CHAMPION CORPORATION COMMON STOCK;BASIC INDUSTRIES;HOMEBUILDING
178;SLB;SCHLUMBERGER LIMITED;;
538;SLG;SL GREEN REALTY CORP COMMON STOCK;CONSUMER SERVICES;REAL ESTATE INVESTMENT TRUSTS
746;SM;SM ENERGY COMPANY COMMON STOCK;ENERGY;OIL & GAS PRODUCTION
409;SMAR;SMARTSHEET INC. CLASS A COMMON STOCK;TECHNOLOGY;EDP SERVICES
372;SMG;SCOTTS MIRACLE-GRO COMPANY (THE) COMMON STOCK;BASIC INDUSTRIES;AGRICULTURAL CHEMICALS
350;SNA;SNAP-ON INCORPORATED COMMON STOCK;CAPITAL GOODS;DIVERSIFIED MANUFACTURE
179;SNAP;SNAP INC.;;
53;SNAP;SNAP INC. CLASS A COMMON STOCK;TECHNOLOGY;COMPUTER SOFTWARE: PREPACKAGED SOFTWARE
664;SNDR;SCHNEIDER NATIONAL INC. COMMON STOCK;TRANSPORTATION;TRUCKING FREIGHT/COURIER SERVICES
72;SNOW;SNOWFLAKE INC. CLASS A COMMON STOCK;TECHNOLOGY;COMPUTER SOFTWARE: PREPACKAGED SOFTWARE
484;SNV;SYNOVUS FINANCIAL CORP. COMMON STOCK;FINANCE;MAJOR BANKS
505;SNX;SYNNEX CORPORATION COMMON STOCK;TECHNOLOGY;RETAIL: COMPUTER SOFTWARE & PERIPHERAL EQUIPMENT
86;SO;SOUTHERN COMPANY (THE) COMMON STOCK;PUBLIC UTILITIES;POWER GENERATION
180;SOFI;SOFI TECHNOLOGIES, INC.;;
728;SOGO;SOGOU INC. AMERICAN DEPOSITARY SHARES EACH REPRESENTING ONE CLASS A ORDINARY SHARE;TECHNOLOGY;EDP SERVICES
489;SON;SONOCO PRODUCTS COMPANY COMMON STOCK;BASIC INDUSTRIES;CONTAINERS/PACKAGING
688;SPB;SPECTRUM BRANDS HOLDINGS INC. COMMON STOCK;;
181;SPCE;VIRGIN GALACTIC HOLDINGS, INC.;;
119;SPG;SIMON PROPERTY GROUP INC. COMMON STOCK;CONSUMER SERVICES;REAL ESTATE INVESTMENT TRUSTS
55;SPGI;S&P GLOBAL INC. COMMON STOCK;FINANCE;INVESTMENT MANAGERS
559;SPR;SPIRIT AEROSYSTEMS HOLDINGS INC. COMMON STOCK;CAPITAL GOODS;MILITARY/GOVERNMENT/TECHNICAL
790;SPXC;SPX CORPORATION COMMON STOCK;CAPITAL GOODS;INDUSTRIAL MACHINERY/COMPONENTS
49;SQ;SQUARE INC. CLASS A COMMON STOCK;TECHNOLOGY;COMPUTER SOFTWARE: PREPACKAGED SOFTWARE
679;SR;SPIRE INC. COMMON STOCK;PUBLIC UTILITIES;OIL/GAS TRANSMISSION
543;SRC;SPIRIT REALTY CAPITAL INC. COMMON STOCK;CONSUMER SERVICES;REAL ESTATE INVESTMENT TRUSTS
125;SRE;SEMPRA ENERGY COMMON STOCK;PUBLIC UTILITIES;OIL/GAS TRANSMISSION
589;SSD;SIMPSON MANUFACTURING COMPANY INC. COMMON STOCK;CAPITAL GOODS;INDUSTRIAL SPECIALTIES
678;SSTK;SHUTTERSTOCK INC. COMMON STOCK;;
520;STAG;STAG INDUSTRIAL INC. COMMON STOCK;CONSUMER SERVICES;REAL ESTATE INVESTMENT TRUSTS
237;STE;STERIS PLC (IRELAND) ORDINARY SHARES;HEALTH CARE;INDUSTRIAL SPECIALTIES
616;STEM;STEM INC. CLASS A COMMON STOCK;TECHNOLOGY;COMPUTER SOFTWARE: PREPACKAGED SOFTWARE
580;STL;STERLING BANCORP;FINANCE;MAJOR BANKS
182;STNE;STONECO LTD.;;
401;STOR;STORE CAPITAL CORPORATION COMMON STOCK;CONSUMER SERVICES;REAL ESTATE INVESTMENT TRUSTS
186;STT;STATE STREET CORPORATION COMMON STOCK;FINANCE;INVESTMENT MANAGERS
452;STWD;STARWOOD PROPERTY TRUST INC. STARWOOD PROPERTY TRUST INC.;CONSUMER SERVICES;REAL ESTATE INVESTMENT TRUSTS
118;STZ;CONSTELLATION BRANDS INC. COMMON STOCK;CONSUMER NON-DURABLES;BEVERAGES (PRODUCTION/DISTRIBUTION)
183;SU;SUNCOR ENERGY INC.;;
250;SUI;SUN COMMUNITIES INC. COMMON STOCK;CONSUMER SERVICES;REAL ESTATE INVESTMENT TRUSTS
629;SUM;SUMMIT MATERIALS INC. CLASS A COMMON STOCK;CAPITAL GOODS;BUILDING MATERIALS
671;SUN;SUNOCO LP COMMON UNITS REPRESENTING LIMITED PARTNER INTERESTS;ENERGY;OIL REFINING/MARKETING
551;SWI;SOLARWINDS CORPORATION COMMON STOCK;TECHNOLOGY;COMPUTER SOFTWARE: PREPACKAGED SOFTWARE
159;SWK;STANLEY BLACK & DECKER INC. COMMON STOCK;CAPITAL GOODS;DIVERSIFIED MANUFACTURE
670;SWN;SOUTHWESTERN ENERGY COMPANY COMMON STOCK;ENERGY;OIL & GAS PRODUCTION
184;SWN;SOUTHWESTERN ENERGY COMPANY;;
676;SWX;SOUTHWEST GAS HOLDINGS INC. COMMON STOCK (DE);PUBLIC UTILITIES;OIL & GAS PRODUCTION
675;SXT;SENSIENT TECHNOLOGIES CORPORATION COMMON STOCK;BASIC INDUSTRIES;MAJOR CHEMICALS
185;SYF;SYNCHRONY FINANCIAL COMMON STOCK;FINANCE;DIVERSIFIED FINANCIAL SERVICES
56;SYK;STRYKER CORPORATION COMMON STOCK;HEALTH CARE;MEDICAL/DENTAL INSTRUMENTS
133;SYY;SYSCO CORPORATION COMMON STOCK;CONSUMER NON-DURABLES;FOOD DISTRIBUTORS
18;T;AT&T INC.;PUBLIC UTILITIES;TELECOMMUNICATIONS EQUIPMENT
185;T;AT&T INC.;;
186;TAL;TAL EDUCATION GROUP;;
187;TCEHY;TENCENT HOLDINGS LIMITED;;
546;TDC;TERADATA CORPORATION COMMON STOCK;TECHNOLOGY;EDP SERVICES
138;TDG;TRANSDIGM GROUP INCORPORATED TRANSDIGM GROUP INC. COMMON STOCK;CAPITAL GOODS;MILITARY/GOVERNMENT/TECHNICAL
206;TDOC;TELADOC HEALTH INC. COMMON STOCK;HEALTH CARE;MEDICAL/NURSING SERVICES
788;TDS;TELEPHONE AND DATA SYSTEMS INC. COMMON SHARES;PUBLIC UTILITIES;TELECOMMUNICATIONS EQUIPMENT
249;TDY;TELEDYNE TECHNOLOGIES INCORPORATED COMMON STOCK;CAPITAL GOODS;INDUSTRIAL MACHINERY/COMPONENTS
188;TECK;TECK RESOURCES LIMITED;;
726;TEX;TEREX CORPORATION COMMON STOCK;CAPITAL GOODS;CONSTRUCTION/AG EQUIPMENT/TRUCKS
71;TFC;TRUIST FINANCIAL CORPORATION COMMON STOCK;FINANCE;MAJOR BANKS
189;TFC;TRUIST FINANCIAL CORPORATION;;
262;TFX;TELEFLEX INCORPORATED COMMON STOCK;HEALTH CARE;MEDICAL/DENTAL INSTRUMENTS
640;TGNA;TEGNA INC;CONSUMER SERVICES;BROADCASTING
45;TGT;TARGET CORPORATION COMMON STOCK;CONSUMER SERVICES;DEPARTMENT/SPECIALTY RETAIL STORES
463;THC;TENET HEALTHCARE CORPORATION COMMON STOCK;HEALTH CARE;HOSPITAL/NURSING MANAGEMENT
587;THG;HANOVER INSURANCE GROUP INC;FINANCE;PROPERTY-CASUALTY INSURERS
519;THO;THOR INDUSTRIES INC. COMMON STOCK;CONSUMER NON-DURABLES;HOMEBUILDING
806;THS;TREEHOUSE FOODS INC. COMMON STOCK;CONSUMER NON-DURABLES;PACKAGED FOODS
190;TJX;THE TJX COMPANIES, INC.;;
66;TJX;TJX COMPANIES INC. (THE) COMMON STOCK;CONSUMER SERVICES;DEPARTMENT/SPECIALTY RETAIL STORES
510;TKR;TIMKEN COMPANY (THE) COMMON STOCK;CAPITAL GOODS;METAL FABRICATIONS
191;TLRY;TILRAY, INC.;;
192;TME;TENCENT MUSIC ENTERTAINMENT GROUP;;
708;TMHC;TAYLOR MORRISON HOME CORPORATION COMMON STOCK;CAPITAL GOODS;HOMEBUILDING
21;TMO;THERMO FISHER SCIENTIFIC INC COMMON STOCK;CAPITAL GOODS;BIOTECHNOLOGY: LABORATORY ANALYTICAL INSTRUMENTS
565;TNL;TRAVEL   LEISURE CO. COMMON  STOCK;TRANSPORTATION;OTHER CONSUMER SERVICES
471;TOL;TOLL BROTHERS INC. COMMON STOCK;CAPITAL GOODS;HOMEBUILDING
809;TPH;TRI POINTE HOMES INC. COMMON STOCK;CAPITAL GOODS;HOMEBUILDING
346;TPL;TEXAS PACIFIC LAND CORPORATION COMMON STOCK;ENERGY;OIL & GAS PRODUCTION
349;TPR;TAPESTRY INC. COMMON STOCK;CONSUMER NON-DURABLES;APPAREL
458;TPX;TEMPUR SEALY INTERNATIONAL INC. COMMON STOCK;CONSUMER DURABLES;HOME FURNISHINGS
829;TR;TOOTSIE ROLL INDUSTRIES INC. COMMON STOCK;CONSUMER NON-DURABLES;SPECIALTY FOODS
356;TREX;TREX COMPANY INC. COMMON STOCK;;
377;TRGP;TARGA RESOURCES INC. COMMON STOCK;PUBLIC UTILITIES;NATURAL GAS DISTRIBUTION
111;TRI;THOMSON REUTERS CORP ORDINARY SHARES;;
755;TRN;TRINITY INDUSTRIES INC. COMMON STOCK;CAPITAL GOODS;RAILROADS
606;TRNO;TERRENO REALTY CORPORATION COMMON STOCK;CONSUMER SERVICES;REAL ESTATE INVESTMENT TRUSTS
707;TROX;TRONOX HOLDINGS PLC ORDINARY SHARES (UK);BASIC INDUSTRIES;MULTI-SECTOR COMPANIES
231;TRU;TRANSUNION COMMON STOCK;TECHNOLOGY;ADVERTISING
137;TRV;THE TRAVELERS COMPANIES INC. COMMON STOCK;FINANCE;PROPERTY-CASUALTY INSURERS
193;TSLA;TESLA, INC.;;
194;TSM;TAIWAN SEMICONDUCTOR MANUFACTURING COMPANY LIMITED;;
198;TSN;TYSON FOODS INC. COMMON STOCK;CONSUMER NON-DURABLES;MEAT/POULTRY/FISH
358;TTC;TORO COMPANY (THE) COMMON STOCK;CAPITAL GOODS;TOOLS/HARDWARE
82;TWLO;TWILIO INC. CLASS A COMMON STOCK;CAPITAL GOODS;INDUSTRIAL MACHINERY/COMPONENTS
849;TWO;TWO HARBORS INVESTMENT CORP;CONSUMER SERVICES;REAL ESTATE INVESTMENT TRUSTS
195;TWTR;TWITTER, INC.;;
296;TXT;TEXTRON INC. COMMON STOCK;CAPITAL GOODS;AEROSPACE
270;TYL;TYLER TECHNOLOGIES INC. COMMON STOCK;TECHNOLOGY;COMPUTER SOFTWARE: PREPACKAGED SOFTWARE
167;U;UNITY SOFTWARE INC. COMMON STOCK;TECHNOLOGY;RETAIL: COMPUTER SOFTWARE & PERIPHERAL EQUIPMENT
429;UA;UNDER ARMOUR INC. CLASS C COMMON STOCK;CONSUMER NON-DURABLES;APPAREL
392;UAA;UNDER ARMOUR INC. CLASS A COMMON STOCK;CONSUMER NON-DURABLES;APPAREL
196;UAL;UNITED AIRLINES HOLDINGS, INC.;;
197;UBER;UBER TECHNOLOGIES, INC.;;
300;UDR;UDR INC. COMMON STOCK;CONSUMER SERVICES;REAL ESTATE INVESTMENT TRUSTS
832;UE;URBAN EDGE PROPERTIES COMMON SHARES OF BENEFICIAL INTEREST;CONSUMER SERVICES;REAL ESTATE INVESTMENT TRUSTS
388;UGI;UGI CORPORATION COMMON STOCK;PUBLIC UTILITIES;NATURAL GAS DISTRIBUTION
335;UHS;UNIVERSAL HEALTH SERVICES INC. COMMON STOCK;HEALTH CARE;HOSPITAL/NURSING MANAGEMENT
259;UI;UBIQUITI INC. COMMON STOCK;TECHNOLOGY;RADIO AND TELEVISION BROADCASTING AND COMMUNICATIONS EQUIPMENT
198;UMC;UNITED MICROELECTRONICS CORPORATION;;
622;UNF;UNIFIRST CORPORATION COMMON STOCK;MISCELLANEOUS;BUSINESS SERVICES
855;UNFI;UNITED NATURAL FOODS INC. COMMON STOCK;CONSUMER NON-DURABLES;FOOD DISTRIBUTORS
4;UNH;UNITEDHEALTH GROUP INCORPORATED COMMON STOCK (DE);HEALTH CARE;MEDICAL SPECIALITIES
532;UNM;UNUM GROUP COMMON STOCK;FINANCE;ACCIDENT &HEALTH INSURANCE
34;UNP;UNION PACIFIC CORPORATION COMMON STOCK;TRANSPORTATION;RAILROADS
621;UNVR;UNIVAR SOLUTIONS INC. COMMON STOCK;BASIC INDUSTRIES;SPECIALTY CHEMICALS
25;UPS;UNITED PARCEL SERVICE INC. COMMON STOCK;TRANSPORTATION;AIR FREIGHT/DELIVERY SERVICES
199;UPST;UPSTART HOLDINGS, INC.;;
216;URI;UNITED RENTALS INC. COMMON STOCK;TECHNOLOGY;DIVERSIFIED COMMERCIAL SERVICES
63;USB;U.S. BANCORP COMMON STOCK;FINANCE;MAJOR BANKS
200;USB;U.S. BANCORP;;
426;USFD;US FOODS HOLDING CORP. COMMON STOCK;CONSUMER NON-DURABLES;SPECIALTY FOODS
723;USM;UNITED STATES CELLULAR CORPORATION COMMON STOCK;PUBLIC UTILITIES;TELECOMMUNICATIONS EQUIPMENT
871;USNA;USANA HEALTH SCIENCES INC. COMMON STOCK;CONSUMER DURABLES;SPECIALTY CHEMICALS
802;UTF;COHEN & STEERS INFRASTRUCTURE FUND INC COMMON STOCK;FINANCE;FINANCE COMPANIES
741;UTZ;UTZ BRANDS INC CLASS A COMMON STOCK ;CONSUMER NON-DURABLES;PACKAGED FOODS
201;V;VISA INC.;;
0;V;VISA INC.;MISCELLANEOUS;BUSINESS SERVICES
472;VAC;MARRIOTT VACATIONS WORLDWIDE CORPORATION COMMON STOCK;CONSUMER SERVICES;HOTELS/RESORTS
202;VALE;VALE S.A.;;
374;VER;VEREIT INC. COMMON STOCK;CONSUMER SERVICES;REAL ESTATE INVESTMENT TRUSTS
166;VFC;V.F. CORPORATION COMMON STOCK;;
854;VGR;VECTOR GROUP LTD. COMMON STOCK;CONSUMER NON-DURABLES;FARMING/SEEDS/MILLING
203;VIAC;VIACOMCBS INC.;;
204;VICI;VICI PROPERTIES INC.;;
205;VIPS;VIPSHOP HOLDINGS LIMITED;;
156;VLO;VALERO ENERGY CORPORATION COMMON STOCK;ENERGY;INTEGRATED OIL COMPANIES
213;VMC;VULCAN MATERIALS COMPANY (HOLDING COMPANY) COMMON STOCK;;
582;VMI;VALMONT INDUSTRIES INC. COMMON STOCK;CAPITAL GOODS;DIVERSIFIED MANUFACTURE
85;VMW;VMWARE INC. COMMON STOCK CLASS A;TECHNOLOGY;COMPUTER SOFTWARE: PREPACKAGED SOFTWARE
410;VNO;VORNADO REALTY TRUST COMMON STOCK;CONSUMER SERVICES;REAL ESTATE INVESTMENT TRUSTS
462;VOYA;VOYA FINANCIAL INC. COMMON STOCK;FINANCE;INVESTMENT MANAGERS
395;VRT;VERTIV HOLDINGS LLC CLASS A COMMON STOCK;CONSUMER DURABLES;ELECTRICAL PRODUCTS
735;VSH;VISHAY INTERTECHNOLOGY INC. COMMON STOCK;CAPITAL GOODS;INDUSTRIAL MACHINERY/COMPONENTS
803;VSTO;VISTA OUTDOOR INC. COMMON STOCK;CONSUMER NON-DURABLES;RECREATIONAL PRODUCTS/TOYS
221;VTR;VENTAS INC. COMMON STOCK;CONSUMER SERVICES;REAL ESTATE INVESTMENT TRUSTS
206;VTRS;VIATRIS INC.;;
527;VVV;VALVOLINE INC. COMMON STOCK;BASIC INDUSTRIES;AUTOMOTIVE AFTERMARKET
207;VZ;VERIZON COMMUNICATIONS INC.;;
157;W;WAYFAIR INC. CLASS A COMMON STOCK;CONSUMER SERVICES;CATALOG/SPECIALTY DISTRIBUTION
293;WAB;WESTINGHOUSE AIR BRAKE TECHNOLOGIES CORPORATION COMMON STOCK;CAPITAL GOODS;RAILROADS
387;WAL;WESTERN ALLIANCE BANCORPORATION COMMON STOCK (DE);FINANCE;MAJOR BANKS
228;WAT;WATERS CORPORATION COMMON STOCK;HEALTH CARE;MEDICAL SPECIALITIES
208;WBA;WALGREENS BOOTS ALLIANCE, INC.;;
573;WBS;WEBSTER FINANCIAL CORPORATION COMMON STOCK;FINANCE;MAJOR BANKS
567;WCC;WESCO INTERNATIONAL INC. COMMON STOCK;CONSUMER NON-DURABLES;TELECOMMUNICATIONS EQUIPMENT
703;WD;WALKER & DUNLOP INC COMMON STOCK;FINANCE;FINANCE: CONSUMER SERVICES
190;WEC;WEC ENERGY GROUP INC. COMMON STOCK;PUBLIC UTILITIES;POWER GENERATION
152;WELL;WELLTOWER INC. COMMON STOCK;CONSUMER SERVICES;REAL ESTATE INVESTMENT TRUSTS
412;WES;WESTERN MIDSTREAM PARTNERS LP COMMON UNITS REPRESENTING LIMITED PARTNER INTERESTS;ENERGY;OILFIELD SERVICES/EQUIPMENT
418;WEX;WEX INC. COMMON STOCK;TECHNOLOGY;EDP SERVICES
209;WFC;WELLS FARGO & COMPANY;;
24;WFC;WELLS FARGO & COMPANY COMMON STOCK;FINANCE;MAJOR BANKS
840;WGO;WINNEBAGO INDUSTRIES INC. COMMON STOCK;CONSUMER NON-DURABLES;HOMEBUILDING
322;WHR;WHIRLPOOL CORPORATION COMMON STOCK;CONSUMER DURABLES;CONSUMER ELECTRONICS/APPLIANCES
210;WISH;CONTEXTLOGIC INC.;;
536;WK;WORKIVA INC. CLASS A COMMON STOCK;TECHNOLOGY;COMPUTER SOFTWARE: PREPACKAGED SOFTWARE
355;WLK;WESTLAKE CHEMICAL CORPORATION COMMON STOCK;BASIC INDUSTRIES;MAJOR CHEMICALS
