;Ticker;Name;Sector;Industry
861;ETY;EATON VANCE TAX-MANAGED DIVERSIFIED EQUITY INCOME FUND COMMON SHARES OF BENEFICIAL INTEREST;FINANCE;FINANCE COMPANIES
819;EVA;ENVIVA PARTNERS LP COMMON UNITS REPRESENTING LIMITED PARTNER INTERESTS;;
544;EVR;EVERCORE INC. CLASS A COMMON STOCK;FINANCE;INVESTMENT MANAGERS
842;EVRI;EVERI HOLDINGS INC. COMMON STOCK;CONSUMER SERVICES;RECREATIONAL PRODUCTS/TOYS
875;EVT;EATON VANCE TAX ADVANTAGED DIVIDEND INCOME FUND COMMON SHARES OF BENEFICIAL INTEREST;FINANCE;FINANCE COMPANIES
87;EW;EDWARDS LIFESCIENCES CORPORATION COMMON STOCK;HEALTH CARE;INDUSTRIAL SPECIALTIES
68;EXC;EXELON CORPORATION;;
747;EXG;EATON VANCE TAX-MANAGED GLOBAL DIVERSIFIED EQUITY INCOME FUND EATON VANCE TAX-MANAGED GLOBAL DIVERSIFIED EQUITY INCOME FUND COMMON SHARES OF BENEFICIAL INTEREST;FINANCE;FINANCE COMPANIES
513;EXP;EAGLE MATERIALS INC COMMON STOCK;CAPITAL GOODS;BUILDING MATERIALS
220;EXR;EXTRA SPACE STORAGE INC COMMON STOCK;CONSUMER SERVICES;REAL ESTATE INVESTMENT TRUSTS
90;F;FORD MOTOR COMPANY COMMON STOCK;CAPITAL GOODS;AUTO MANUFACTURING
69;F;FORD MOTOR COMPANY;;
479;FAF;FIRST AMERICAN CORPORATION (NEW) COMMON STOCK;FINANCE;SPECIALTY INSURERS
70;FB;FACEBOOK, INC.;;
831;FBC;FLAGSTAR BANCORP INC. COMMON STOCK;FINANCE;SAVINGS INSTITUTIONS
320;FBHS;FORTUNE BRANDS HOME & SECURITY INC. COMMON STOCK;CONSUMER DURABLES;BUILDING PRODUCTS
71;FCEL;FUELCELL ENERGY, INC.;;
598;FCN;FTI CONSULTING INC. COMMON STOCK;CONSUMER SERVICES;PROFESSIONAL SERVICES
845;FCPT;FOUR CORNERS PROPERTY TRUST INC. COMMON STOCK;CONSUMER SERVICES;REAL ESTATE INVESTMENT TRUSTS
99;FCX;FREEPORT-MCMORAN INC. COMMON STOCK;BASIC INDUSTRIES;PRECIOUS METALS
72;FCX;FREEPORT-MCMORAN INC.;;
67;FDX;FEDEX CORPORATION COMMON STOCK;TRANSPORTATION;AIR FREIGHT/DELIVERY SERVICES
240;FE;FIRSTENERGY CORP. COMMON STOCK;PUBLIC UTILITIES;ELECTRIC UTILITIES: CENTRAL
709;FHI;FEDERATED HERMES INC. COMMON STOCK;FINANCE;INVESTMENT MANAGERS
393;FHN;FIRST HORIZON CORPORATION COMMON STOCK;FINANCE;MAJOR BANKS
309;FICO;FAIR ISAAC CORPROATION COMMON STOCK;TECHNOLOGY;COMPUTER SOFTWARE: PREPACKAGED SOFTWARE
792;FINV;FINVOLUTION GROUP AMERICAN DEPOSITARY SHARES;FINANCE;FINANCE: CONSUMER SERVICES
58;FIS;FIDELITY NATIONAL INFORMATION SERVICES INC. COMMON STOCK;MISCELLANEOUS;BUSINESS SERVICES
769;FIX;COMFORT SYSTEMS USA INC. COMMON STOCK;CAPITAL GOODS;ENGINEERING & CONSTRUCTION
501;FL;FOOT LOCKER INC.;CONSUMER SERVICES;CLOTHING/SHOE/ACCESSORY STORES
574;FLO;FLOWERS FOODS INC. COMMON STOCK;CONSUMER NON-DURABLES;FARMING/SEEDS/MILLING
789;FLOW;SPX FLOW INC. COMMON STOCK;CAPITAL GOODS;INDUSTRIAL MACHINERY/COMPONENTS
801;FLR;FLUOR CORPORATION COMMON STOCK;CAPITAL GOODS;OILFIELD SERVICES/EQUIPMENT
560;FLS;FLOWSERVE CORPORATION COMMON STOCK;CAPITAL GOODS;FLUID CONTROLS
226;FLT;FLEETCOR TECHNOLOGIES INC. COMMON STOCK;TECHNOLOGY;EDP SERVICES
304;FMC;FMC CORPORATION COMMON STOCK;BASIC INDUSTRIES;AGRICULTURAL CHEMICALS
73;FMCC;FEDERAL HOME LOAN MORTGAGE CORPORATION;;
651;FNB;F.N.B. CORPORATION COMMON STOCK;FINANCE;MAJOR BANKS
336;FNF;FNF GROUP OF FIDELITY NATIONAL FINANCIAL INC. COMMON STOCK;FINANCE;SPECIALTY INSURERS
74;FNMA;FEDERAL NATIONAL MORTGAGE ASSOCIATION;;
437;FOUR;SHIFT4 PAYMENTS INC. CLASS A COMMON STOCK;TECHNOLOGY;EDP SERVICES
481;FR;FIRST INDUSTRIAL REALTY TRUST INC. COMMON STOCK;CONSUMER SERVICES;REAL ESTATE INVESTMENT TRUSTS
161;FRC;FIRST REPUBLIC BANK COMMON STOCK;FINANCE;MAJOR BANKS
411;FRT;FEDERAL REALTY INVESTMENT TRUST COMMON STOCK;CONSUMER SERVICES;REAL ESTATE INVESTMENT TRUSTS
813;FSS;FEDERAL SIGNAL CORPORATION COMMON STOCK;TECHNOLOGY;INDUSTRIAL MACHINERY/COMPONENTS
765;FTAI;FORTRESS TRANSPORTATION AND INFRASTRUCTURE INVESTORS LLC COMMON SHARES;TECHNOLOGY;DIVERSIFIED COMMERCIAL SERVICES
75;FTCH;FARFETCH LIMITED;;
76;FUBO;FUBOTV INC.;;
710;FUL;H. B. FULLER COMPANY COMMON STOCK;BASIC INDUSTRIES;HOME FURNISHINGS
796;FUN;CEDAR FAIR L.P. COMMON STOCK;CONSUMER SERVICES;MOVIES/ENTERTAINMENT
77;FUTU;FUTU HOLDINGS LIMITED;;
722;GATX;GATX CORPORATION COMMON STOCK;TRANSPORTATION;RENTAL/LEASING COMPANIES
101;GD;GENERAL DYNAMICS CORPORATION COMMON STOCK;CAPITAL GOODS;INDUSTRIAL MACHINERY/COMPONENTS
308;GDDY;GODADDY INC. CLASS A COMMON STOCK;TECHNOLOGY;EDP SERVICES
794;GDOT;GREEN DOT CORPORATION CLASS A COMMON STOCK $0.001 PAR VALUE;TECHNOLOGY;ADVERTISING
821;GDV;GABELLI DIVIDEND & INCOME TRUST COMMON SHARES OF BENEFICIAL INTEREST;FINANCE;INVESTMENT MANAGERS
46;GE;GENERAL ELECTRIC COMPANY COMMON STOCK;CAPITAL GOODS;AEROSPACE
78;GE;GENERAL ELECTRIC COMPANY;;
683;GEF;GREIF INC. CLASS A COMMON STOCK;;
79;GGB;GERDAU S.A.;;
339;GGG;GRACO INC. COMMON STOCK;CAPITAL GOODS;FLUID CONTROLS
731;GHC;GRAHAM HOLDINGS COMPANY COMMON STOCK;MISCELLANEOUS;SERVICE TO THE HEALTH INDUSTRY
144;GIS;GENERAL MILLS INC. COMMON STOCK;CONSUMER SERVICES;FOOD CHAINS
80;GIS;GENERAL MILLS, INC.;;
653;GKOS;GLAUKOS CORPORATION COMMON STOCK;HEALTH CARE;MEDICAL/DENTAL INSTRUMENTS
384;GL;GLOBE LIFE INC. COMMON STOCK;FINANCE;LIFE INSURANCE
150;GLW;CORNING INCORPORATED COMMON STOCK;CAPITAL GOODS;INDUSTRIAL MACHINERY/COMPONENTS
81;GM;GENERAL MOTORS COMPANY;;
62;GM;GENERAL MOTORS COMPANY COMMON STOCK;CAPITAL GOODS;AUTO MANUFACTURING
299;GME;GAMESTOP CORPORATION COMMON STOCK;CONSUMER SERVICES;ELECTRONICS DISTRIBUTION
460;GMED;GLOBUS MEDICAL INC. CLASS A COMMON STOCK;HEALTH CARE;MEDICAL/DENTAL INSTRUMENTS
210;GNRC;GENERAC HOLDLINGS INC. COMMON STOCK;CONSUMER DURABLES;METAL FABRICATIONS
872;GNW;GENWORTH FINANCIAL INC COMMON STOCK;FINANCE;LIFE INSURANCE
82;GOLD;BARRICK GOLD CORPORATION;;
681;GOLF;ACUSHNET HOLDINGS CORP. COMMON STOCK;CONSUMER NON-DURABLES;RECREATIONAL PRODUCTS/TOYS
269;GPC;GENUINE PARTS COMPANY COMMON STOCK;CAPITAL GOODS;AUTOMOTIVE AFTERMARKET
777;GPI;GROUP 1 AUTOMOTIVE INC. COMMON STOCK;CONSUMER SERVICES;OTHER SPECIALTY STORES
547;GPK;GRAPHIC PACKAGING HOLDING COMPANY;BASIC INDUSTRIES;PAPER
97;GPN;GLOBAL PAYMENTS INC. COMMON STOCK;MISCELLANEOUS;BUSINESS SERVICES
83;GPS;THE GAP, INC.;;
342;GPS;GAP INC. (THE) COMMON STOCK;CONSUMER SERVICES;CLOTHING/SHOE/ACCESSORY STORES
603;GRA;W.R. GRACE & CO. COMMON STOCK;BASIC INDUSTRIES;MAJOR CHEMICALS
84;GS;THE GOLDMAN SACHS GROUP, INC.;;
42;GS;GOLDMAN SACHS GROUP INC. (THE) COMMON STOCK;FINANCE;INVESTMENT BANKERS/BROKERS/SERVICE
85;GSAT;GLOBALSTAR, INC.;;
868;GSBD;GOLDMAN SACHS BDC INC. COMMON STOCK;FINANCE;FINANCE: CONSUMER SERVICES
569;GTLS;CHART INDUSTRIES INC. COMMON STOCK;TECHNOLOGY;ELECTRICAL PRODUCTS
843;GTN;GRAY TELEVISION INC. COMMON STOCK;CONSUMER SERVICES;BROADCASTING
398;GWRE;GUIDEWIRE SOFTWARE INC. COMMON STOCK;TECHNOLOGY;COMPUTER SOFTWARE: PREPACKAGED SOFTWARE
215;GWW;W.W. GRAINGER INC. COMMON STOCK;CONSUMER NON-DURABLES;TELECOMMUNICATIONS EQUIPMENT
435;H;HYATT HOTELS CORPORATION CLASS A COMMON STOCK;CONSUMER SERVICES;HOTELS/RESORTS
712;HAE;HAEMONETICS CORPORATION COMMON STOCK;HEALTH CARE;MEDICAL/DENTAL INSTRUMENTS
86;HAL;HALLIBURTON COMPANY;;
230;HAL;HALLIBURTON COMPANY COMMON STOCK;ENERGY;OIL & GAS PRODUCTION
608;HASI;HANNON ARMSTRONG SUSTAINABLE INFRASTRUCTURE CAPITAL INC. COMMON STOCK;CONSUMER SERVICES;REAL ESTATE INVESTMENT TRUSTS
87;HBAN;HUNTINGTON BANCSHARES INCORPORATED;;
495;HBI;HANESBRANDS INC. COMMON STOCK;CONSUMER NON-DURABLES;APPAREL
81;HCA;HCA HEALTHCARE INC. COMMON STOCK;HEALTH CARE;HOSPITAL/NURSING MANAGEMENT
7;HD;HOME DEPOT INC. (THE) COMMON STOCK;CONSUMER SERVICES;RETAIL: BUILDING MATERIALS
601;HE;HAWAIIAN ELECTRIC INDUSTRIES INC. COMMON STOCK;;
254;HEI;HEICO CORPORATION COMMON STOCK;CAPITAL GOODS;AEROSPACE
823;HEP;HOLLY ENERGY PARTNERS L.P. COMMON STOCK;;
195;HES;HESS CORPORATION COMMON STOCK;ENERGY;OIL & GAS PRODUCTION
549;HFC;HOLLYFRONTIER CORPORATION COMMON STOCK;ENERGY;INTEGRATED OIL COMPANIES
548;HHC;HOWARD HUGHES CORPORATION (THE) COMMON STOCK;CONSUMER SERVICES;REAL ESTATE INVESTMENT TRUSTS
717;HI;HILLENBRAND INC COMMON STOCK;MISCELLANEOUS;CONSUMER SPECIALTIES
218;HIG;HARTFORD FINANCIAL SERVICES GROUP INC. (THE) COMMON STOCK;FINANCE;PROPERTY-CASUALTY INSURERS
430;HII;HUNTINGTON INGALLS INDUSTRIES INC. COMMON STOCK;CAPITAL GOODS;METAL FABRICATIONS
592;HIW;HIGHWOODS PROPERTIES INC. COMMON STOCK;CONSUMER SERVICES;REAL ESTATE INVESTMENT TRUSTS
625;HL;HECLA MINING COMPANY COMMON STOCK;BASIC INDUSTRIES;PRECIOUS METALS
88;HL;HECLA MINING COMPANY;;
550;HLI;HOULIHAN LOKEY INC. CLASS A COMMON STOCK;FINANCE;INVESTMENT MANAGERS
89;HMY;HARMONY GOLD MINING COMPANY LIMITED;;
465;HOG;HARLEY-DAVIDSON INC. COMMON STOCK;CONSUMER NON-DURABLES;MOTOR VEHICLES
816;HOME;AT HOME GROUP INC. COMMON STOCK;CONSUMER SERVICES;HOME FURNISHINGS
677;HP;HELMERICH & PAYNE INC. COMMON STOCK;ENERGY;OIL & GAS PRODUCTION
257;HPE;HEWLETT PACKARD ENTERPRISE COMPANY COMMON STOCK;TECHNOLOGY;ELECTRONIC COMPONENTS
90;HPE;HEWLETT PACKARD ENTERPRISE COMPANY;;
628;HPP;HUDSON PACIFIC PROPERTIES INC. COMMON STOCK;CONSUMER SERVICES;BUILDING OPERATORS
147;HPQ;HP INC. COMMON STOCK;TECHNOLOGY;COMPUTER MANUFACTURING
91;HPQ;HP INC.;;
620;HR;HEALTHCARE REALTY TRUST INCORPORATED COMMON STOCK;CONSUMER SERVICES;REAL ESTATE INVESTMENT TRUSTS
617;HRB;H&R BLOCK INC. COMMON STOCK;MISCELLANEOUS;OTHER CONSUMER SERVICES
461;HRC;HILL-ROM HOLDINGS INC COMMON STOCK;HEALTH CARE;MEDICAL/DENTAL INSTRUMENTS
204;HRL;HORMEL FOODS CORPORATION COMMON STOCK;CONSUMER NON-DURABLES;MEAT/POULTRY/FISH
92;HST;HOST HOTELS & RESORTS, INC.;;
146;HSY;THE HERSHEY COMPANY COMMON STOCK;CONSUMER NON-DURABLES;SPECIALTY FOODS
512;HTA;HEALTHCARE TRUST OF AMERICA INC. CLASS A COMMON STOCK;CONSUMER SERVICES;REAL ESTATE INVESTMENT TRUSTS
880;HTGC;HERCULES CAPITAL INC. COMMON STOCK;FINANCE;FINANCE COMPANIES
748;HTH;HILLTOP HOLDINGS INC.;FINANCE;MAJOR BANKS
382;HUBB;HUBBELL INC COMMON STOCK;CAPITAL GOODS;INDUSTRIAL MACHINERY/COMPONENTS
193;HUBS;HUBSPOT INC. COMMON STOCK;TECHNOLOGY;COMPUTER SOFTWARE: PREPACKAGED SOFTWARE
96;HUM;HUMANA INC. COMMON STOCK;HEALTH CARE;MEDICAL SPECIALITIES
526;HUN;HUNTSMAN CORPORATION COMMON STOCK;BASIC INDUSTRIES;MAJOR CHEMICALS
93;HUT;HUT 8 MINING CORP.;;
645;HUYA;HUYA INC. AMERICAN DEPOSITARY SHARES EACH  REPRESENTING ONE CLASS A ORDINARY SHARE;CONSUMER SERVICES;BROADCASTING
298;HWM;HOWMET AEROSPACE INC. COMMON STOCK;CAPITAL GOODS;INDUSTRIAL MACHINERY/COMPONENTS
553;HXL;HEXCEL CORPORATION COMMON STOCK;CAPITAL GOODS;INDUSTRIAL MACHINERY/COMPONENTS
41;IBM;INTERNATIONAL BUSINESS MACHINES CORPORATION COMMON STOCK;TECHNOLOGY;EDP SERVICES
83;ICE;INTERCONTINENTAL EXCHANGE INC. COMMON STOCK;;
578;IDA;IDACORP INC. COMMON STOCK;PUBLIC UTILITIES;ELECTRIC UTILITIES: CENTRAL
286;IEX;IDEX CORPORATION COMMON STOCK;CAPITAL GOODS;FLUID CONTROLS
139;IFF;INTERNATIONA FLAVORS & FRAGRANCES INC. COMMON STOCK;BASIC INDUSTRIES;MAJOR CHEMICALS
583;IGT;INTERNATIONAL GAME TECHNOLOGY ORDINARY SHARES;CONSUMER SERVICES;MOVIES/ENTERTAINMENT
599;IIPR;INNOVATIVE INDUSTRIAL PROPERTIES INC. COMMON STOCK;CONSUMER SERVICES;REAL ESTATE
94;INFY;INFOSYS LIMITED;;
516;INGR;INGREDION INCORPORATED COMMON STOCK;CONSUMER NON-DURABLES;FARMING/SEEDS/MILLING
557;INSP;INSPIRE MEDICAL SYSTEMS INC. COMMON STOCK;HEALTH CARE;BIOTECHNOLOGY: ELECTROMEDICAL & ELECTROTHERAPEUTIC APPARATUS
865;INT;WORLD FUEL SERVICES CORPORATION COMMON STOCK;ENERGY;OIL REFINING/MARKETING
95;INTC;INTEL CORPORATION;;
227;INVH;INVITATION HOMES INC. COMMON STOCK;CONSUMER SERVICES;REAL ESTATE INVESTMENT TRUSTS
96;IP;INTERNATIONAL PAPER COMPANY;;
212;IP;INTERNATIONAL PAPER COMPANY COMMON STOCK;BASIC INDUSTRIES;CONTAINERS/PACKAGING
333;IPG;INTERPUBLIC GROUP OF COMPANIES INC. (THE) COMMON STOCK;TECHNOLOGY;ADVERTISING
97;IQ;IQIYI, INC.;;
112;IQV;IQVIA HOLDINGS INC. COMMON STOCK;HEALTH CARE;MANAGED HEALTH CARE
244;IR;INGERSOLL RAND INC. COMMON STOCK;CAPITAL GOODS;INDUSTRIAL MACHINERY/COMPONENTS
341;IRM;IRON MOUNTAIN INCORPORATED (DELAWARE)COMMON STOCK REIT;CONSUMER SERVICES;REAL ESTATE INVESTMENT TRUSTS
235;IT;GARTNER INC. COMMON STOCK;FINANCE;DIVERSIFIED COMMERCIAL SERVICES
745;ITGR;INTEGER HOLDINGS CORPORATION COMMON STOCK;HEALTH CARE;MEDICAL/DENTAL INSTRUMENTS
447;ITT;ITT INC. COMMON STOCK ;CAPITAL GOODS;FLUID CONTROLS
98;ITUB;ITA£ UNIBANCO HOLDING S.A.;;
75;ITW;ILLINOIS TOOL WORKS INC. COMMON STOCK;CAPITAL GOODS;INDUSTRIAL MACHINERY/COMPONENTS
338;IVZ;INVESCO LTD COMMON STOCK;FINANCE;INVESTMENT MANAGERS
274;J;JACOBS ENGINEERING GROUP INC. COMMON STOCK;CAPITAL GOODS;OILFIELD SERVICES/EQUIPMENT
623;JBGS;JBG SMITH PROPERTIES COMMON SHARES ;CONSUMER SERVICES;REAL ESTATE INVESTMENT TRUSTS
427;JBL;JABIL INC. COMMON STOCK;TECHNOLOGY;ELECTRICAL PRODUCTS
99;JBLU;JETBLUE AIRWAYS CORPORATION;;
609;JBT;JOHN BEAN TECHNOLOGIES CORPORATION COMMON STOCK;CAPITAL GOODS;DIVERSIFIED MANUFACTURE
100;JD;JD.COM, INC.;;
446;JEF;JEFFERIES FINANCIAL GROUP INC. COMMON STOCK;FINANCE;FINANCE/INVESTORS SERVICES
807;JELD;JELD-WEN HOLDING INC. COMMON STOCK;;
376;JLL;JONES LANG LASALLE INCORPORATED COMMON STOCK;FINANCE;REAL ESTATE
101;JNJ;JOHNSON & JOHNSON;;
2;JNJ;JOHNSON & JOHNSON COMMON STOCK;HEALTH CARE;MAJOR PHARMACEUTICALS
415;JNPR;JUNIPER NETWORKS INC. COMMON STOCK;TECHNOLOGY;COMPUTER PERIPHERAL EQUIPMENT
800;JOE;ST. JOE COMPANY (THE) COMMON STOCK;CONSUMER SERVICES;HOMEBUILDING
1;JPM;JP MORGAN CHASE & CO. COMMON STOCK;FINANCE;MAJOR BANKS
102;JPM;JPMORGAN CHASE & CO.;;
874;JPS;NUVEEN PREFERRED & INCOME SECURITIES FUND;FINANCE;INVESTMENT MANAGERS
535;JWN;NORDSTROM INC. COMMON STOCK;CONSUMER SERVICES;CLOTHING/SHOE/ACCESSORY STORES
223;K;KELLOGG COMPANY COMMON STOCK;CONSUMER NON-DURABLES;PACKAGED FOODS
859;KAI;KADANT INC COMMON STOCK;TECHNOLOGY;INDUSTRIAL MACHINERY/COMPONENTS
841;KAR;KAR AUCTION SERVICES INC COMMON STOCK;;
652;KBH;KB HOME COMMON STOCK;;
556;KBR;KBR INC. COMMON STOCK;CAPITAL GOODS;OILFIELD SERVICES/EQUIPMENT
103;KDP;KEURIG DR PEPPER INC.;;
667;KEX;KIRBY CORPORATION COMMON STOCK;TRANSPORTATION;MARINE TRANSPORTATION
238;KEY;KEYCORP COMMON STOCK;FINANCE;MAJOR BANKS
104;KEY;KEYCORP;;
189;KEYS;KEYSIGHT TECHNOLOGIES INC. COMMON STOCK;CAPITAL GOODS;INDUSTRIAL MACHINERY/COMPONENTS
660;KFY;KORN FERRY COMMON STOCK;TECHNOLOGY;DIVERSIFIED COMMERCIAL SERVICES
105;KGC;KINROSS GOLD CORPORATION;;
416;KIM;KIMCO REALTY CORPORATION COMMON STOCK;CONSUMER SERVICES;REAL ESTATE INVESTMENT TRUSTS
148;KKR;KKR & CO. INC. COMMON STOCK;FINANCE;INVESTMENT MANAGERS
115;KMB;KIMBERLY-CLARK CORPORATION COMMON STOCK;BASIC INDUSTRIES;PAPER
124;KMI;KINDER MORGAN INC. COMMON STOCK;PUBLIC UTILITIES;NATURAL GAS DISTRIBUTION
106;KMI;KINDER MORGAN, INC.;;
596;KMPR;KEMPER CORPORATION;FINANCE;LIFE INSURANCE
752;KMT;KENNAMETAL INC. COMMON STOCK;CAPITAL GOODS;INDUSTRIAL MACHINERY/COMPONENTS
252;KMX;CARMAX INC;CONSUMER SERVICES;OTHER SPECIALTY STORES
454;KNX;KNIGHT-SWIFT TRANSPORTATION HOLDINGS INC.;TRANSPORTATION;TRUCKING FREIGHT/COURIER SERVICES
11;KO;COCA-COLA COMPANY (THE) COMMON STOCK;CONSUMER NON-DURABLES;BEVERAGES (PRODUCTION/DISTRIBUTION)
107;KO;THE COCA-COLA COMPANY;;
179;KR;KROGER COMPANY (THE) COMMON STOCK;CONSUMER SERVICES;FOOD CHAINS
108;KR;THE KROGER CO.;;
434;KRC;KILROY REALTY CORPORATION COMMON STOCK;CONSUMER SERVICES;REAL ESTATE INVESTMENT TRUSTS
422;KSS;KOHL'S CORPORATION COMMON STOCK;CONSUMER SERVICES;DEPARTMENT/SPECIALTY RETAIL STORES
201;KSU;KANSAS CITY SOUTHERN COMMON STOCK;TRANSPORTATION;RAILROADS
770;KW;KENNEDY-WILSON HOLDINGS INC. COMMON STOCK;CONSUMER SERVICES;REAL ESTATE
631;KWR;QUAKER CHEMICAL CORPORATION COMMON STOCK;BASIC INDUSTRIES;AUTOMOTIVE AFTERMARKET
306;L;LOEWS CORPORATION COMMON STOCK;FINANCE;PROPERTY-CASUALTY INSURERS
381;LAD;LITHIA MOTORS INC. COMMON STOCK;CONSUMER SERVICES;OTHER SPECIALTY STORES
245;LB;L BRANDS INC.;CONSUMER SERVICES;CLOTHING/SHOE/ACCESSORY STORES
773;LBRT;LIBERTY OILFIELD SERVICES INC. CLASS A COMMON STOCK;ENERGY;OILFIELD SERVICES/EQUIPMENT
109;LCID;LUCID GROUP, INC.;;
719;LCII;LCI INDUSTRIES;CAPITAL GOODS;AUTO PARTS:O.E.M.
303;LDOS;LEIDOS HOLDINGS INC. COMMON STOCK;TECHNOLOGY;EDP SERVICES
371;LEA;LEAR CORPORATION COMMON STOCK;CAPITAL GOODS;AUTO PARTS:O.E.M.
480;LEG;LEGGETT & PLATT INCORPORATED COMMON STOCK;CONSUMER DURABLES;HOME FURNISHINGS
170;LEN;LENNAR CORPORATION CLASS A COMMON STOCK;CONSUMER SERVICES;BUILDING OPERATORS
370;LEVI;LEVI STRAUSS & CO CLASS A COMMON STOCK;BASIC INDUSTRIES;INDUSTRIAL SPECIALTIES
203;LH;LABORATORY CORPORATION OF AMERICA HOLDINGS COMMON STOCK;HEALTH CARE;MEDICAL SPECIALITIES
113;LHX;L3HARRIS TECHNOLOGIES INC. COMMON STOCK;CAPITAL GOODS;INDUSTRIAL MACHINERY/COMPONENTS
110;LI;LI AUTO INC.;;
343;LII;LENNOX INTERNATIONAL INC. COMMON STOCK;CAPITAL GOODS;INDUSTRIAL MACHINERY/COMPONENTS
13;LLY;ELI LILLY AND COMPANY COMMON STOCK;HEALTH CARE;MAJOR PHARMACEUTICALS
485;LMND;LEMONADE INC. COMMON STOCK;FINANCE;PROPERTY-CASUALTY INSURERS
54;LMT;LOCKHEED MARTIN CORPORATION COMMON STOCK;CAPITAL GOODS;AEROSPACE
348;LNC;LINCOLN NATIONAL CORPORATION COMMON STOCK;FINANCE;LIFE INSURANCE
37;LOW;LOWE'S COMPANIES INC. COMMON STOCK;CONSUMER SERVICES;RETAIL: BUILDING MATERIALS
518;LPX;LOUISIANA-PACIFIC CORPORATION COMMON STOCK;;
431;LSI;LIFE STORAGE INC. COMMON STOCK;CONSUMER SERVICES;REAL ESTATE INVESTMENT TRUSTS
764;LTHM;LIVENT CORPORATION COMMON STOCK;BASIC INDUSTRIES;INDUSTRIAL SPECIALTIES
111;LU;LUFAX HOLDING LTD;;
295;LUMN;LUMEN TECHNOLOGIES INC. COMMON STOCK;PUBLIC UTILITIES;TELECOMMUNICATIONS EQUIPMENT
164;LUV;SOUTHWEST AIRLINES COMPANY COMMON STOCK;TRANSPORTATION;AIR FREIGHT/DELIVERY SERVICES
112;LUV;SOUTHWEST AIRLINES CO.;;
132;LVS;LAS VEGAS SANDS CORP. COMMON STOCK;CONSUMER SERVICES;HOTELS/RESORTS
113;LVS;LAS VEGAS SANDS CORP.;;
684;LXP;LEXINGTON REALTY TRUST COMMON STOCK;CONSUMER SERVICES;REAL ESTATE INVESTMENT TRUSTS
114;LYFT;LYFT, INC.;;
115;LYG;LLOYDS BANKING GROUP PLC;;
242;LYV;LIVE NATION ENTERTAINMENT INC. COMMON STOCK;CONSUMER SERVICES;MOVIES/ENTERTAINMENT
116;M;MACY'S, INC.;;
517;M;MACY'S INC COMMON STOCK;CONSUMER SERVICES;DEPARTMENT/SPECIALTY RETAIL STORES
5;MA;MASTERCARD INCORPORATED COMMON STOCK;MISCELLANEOUS;BUSINESS SERVICES
253;MAA;MID-AMERICA APARTMENT COMMUNITIES INC. COMMON STOCK;CONSUMER SERVICES;REAL ESTATE INVESTMENT TRUSTS
668;MAC;MACERICH COMPANY (THE) COMMON STOCK;CONSUMER SERVICES;REAL ESTATE INVESTMENT TRUSTS
768;MAIN;MAIN STREET CAPITAL CORPORATION COMMON STOCK;FINANCE;FINANCE/INVESTORS SERVICES
493;MAN;MANPOWERGROUP COMMON STOCK;TECHNOLOGY;PROFESSIONAL SERVICES
117;MARA;MARATHON DIGITAL HOLDINGS, INC.;;
301;MAS;MASCO CORPORATION COMMON STOCK;CONSUMER DURABLES;BUILDING PRODUCTS
780;MATX;MATSON INC. COMMON STOCK;TRANSPORTATION;MARINE TRANSPORTATION
26;MCD;MCDONALD'S CORPORATION COMMON STOCK;CONSUMER SERVICES;RESTAURANTS
181;MCK;MCKESSON CORPORATION COMMON STOCK;HEALTH CARE;OTHER PHARMACEUTICALS
80;MCO;MOODY'S CORPORATION COMMON STOCK;TECHNOLOGY;ADVERTISING
702;MCY;MERCURY GENERAL CORPORATION COMMON STOCK;FINANCE;PROPERTY-CASUALTY INSURERS
785;MD;MEDNAX INC. COMMON STOCK;HEALTH CARE;MEDICAL SPECIALITIES
687;MDC;M.D.C. HOLDINGS INC. COMMON STOCK;CAPITAL GOODS;HOMEBUILDING
563;MDLA;MEDALLIA INC. COMMON STOCK;TECHNOLOGY;EDP SERVICES
118;MDLA;MEDALLIA, INC.;;
119;MDLZ;MONDELEZ INTERNATIONAL, INC.;;
27;MDT;MEDTRONIC PLC. ORDINARY SHARES;HEALTH CARE;BIOTECHNOLOGY: ELECTROMEDICAL & ELECTROTHERAPEUTIC APPARATUS
120;MDT;MEDTRONIC PLC;;
500;MDU;MDU RESOURCES GROUP INC. COMMON STOCK (HOLDING COMPANY);CAPITAL GOODS;BUILDING MATERIALS
121;ME;23ANDME HOLDING CO.;;
720;MED;MEDIFAST INC COMMON STOCK;HEALTH CARE;MAJOR PHARMACEUTICALS
104;MET;METLIFE INC. COMMON STOCK;FINANCE;LIFE INSURANCE
851;MFA;MFA FINANCIAL INC.;CONSUMER SERVICES;REAL ESTATE INVESTMENT TRUSTS
222;MGM;MGM RESORTS INTERNATIONAL COMMON STOCK;CONSUMER SERVICES;HOTELS/RESORTS
541;MGP;MGM GROWTH PROPERTIES LLC CLASS A COMMON SHARES REPRESENTING LIMITED LIABILITY COMPANY INTERESTS;CONSUMER SERVICES;REAL ESTATE INVESTMENT TRUSTS
669;MGY;MAGNOLIA OIL & GAS CORPORATION CLASS A COMMON STOCK;ENERGY;OIL & GAS PRODUCTION
324;MHK;MOHAWK INDUSTRIES INC. COMMON STOCK;CONSUMER DURABLES;HOME FURNISHINGS
705;MIC;MACQUARIE INFRASTRUCTURE CORPORATION COMMON STOCK;TRANSPORTATION;AEROSPACE
214;MKC;MCCORMICK & COMPANY INCORPORATED COMMON STOCK;CONSUMER NON-DURABLES;FARMING/SEEDS/MILLING
290;MKL;MARKEL CORPORATION COMMON STOCK;FINANCE;PROPERTY-CASUALTY INSURERS
810;MLI;MUELLER INDUSTRIES INC. COMMON STOCK;BASIC INDUSTRIES;METAL FABRICATIONS
217;MLM;MARTIN MARIETTA MATERIALS INC. COMMON STOCK;CAPITAL GOODS;BUILDING MATERIALS
76;MMC;MARSH & MCLENNAN COMPANIES INC. COMMON STOCK;FINANCE;SPECIALTY INSURERS
47;MMM;3M COMPANY COMMON STOCK;HEALTH CARE;MEDICAL/DENTAL INSTRUMENTS
363;MMP;MAGELLAN MIDSTREAM PARTNERS L.P. LIMITED PARTNERSHIP;ENERGY;OIL & GAS PRODUCTION
537;MMS;MAXIMUS INC. COMMON STOCK;MISCELLANEOUS;BUSINESS SERVICES
61;MO;ALTRIA GROUP INC.;CONSUMER NON-DURABLES;FARMING/SEEDS/MILLING
122;MO;ALTRIA GROUP, INC.;;
302;MOH;MOLINA HEALTHCARE INC COMMON STOCK;HEALTH CARE;MEDICAL SPECIALITIES
352;MOS;MOSAIC COMPANY (THE) COMMON STOCK;BASIC INDUSTRIES;AGRICULTURAL CHEMICALS
127;MPC;MARATHON PETROLEUM CORPORATION COMMON STOCK;ENERGY;INTEGRATED OIL COMPANIES
123;MPC;MARATHON PETROLEUM CORPORATION;;
124;MPLN;MULTIPLAN CORPORATION;;
171;MPLX;MPLX LP COMMON UNITS REPRESENTING LIMITED PARTNER INTERESTS;ENERGY;OIL & GAS PRODUCTION
347;MPW;MEDICAL PROPERTIES TRUST INC. COMMON STOCK;CONSUMER SERVICES;REAL ESTATE INVESTMENT TRUSTS
22;MRK;MERCK & COMPANY INC. COMMON STOCK (NEW);HEALTH CARE;MAJOR PHARMACEUTICALS
125;MRK;MERCK & CO., INC.;;
126;MRNA;MODERNA, INC.;;
366;MRO;MARATHON OIL CORPORATION COMMON STOCK;ENERGY;OIL & GAS PRODUCTION
127;MRO;MARATHON OIL CORPORATION;;
128;MRVL;MARVELL TECHNOLOGY, INC.;;
28;MS;MORGAN STANLEY COMMON STOCK;FINANCE;INVESTMENT BANKERS/BROKERS/SERVICE
129;MS;MORGAN STANLEY;;
499;MSA;MSA SAFETY INCORPORATED COMMON STOCK;MISCELLANEOUS;DIVERSIFIED MANUFACTURE
117;MSCI;MSCI INC COMMON STOCK;TECHNOLOGY;ADVERTISING
130;MSFT;MICROSOFT CORPORATION;;
635;MSGS;MADISON SQUARE GARDEN SPORTS CORP. CLASS A COMMON STOCK (NEW);CONSUMER SERVICES;HOTELS/RESORTS
141;MSI;MOTOROLA SOLUTIONS INC. COMMON STOCK;TECHNOLOGY;RADIO AND TELEVISION BROADCASTING AND COMMUNICATIONS EQUIPMENT
576;MSM;MSC INDUSTRIAL DIRECT COMPANY INC. COMMON STOCK;CAPITAL GOODS;INDUSTRIAL MACHINERY/COMPONENTS
614;MSP;DATTO HOLDING CORP. COMMON STOCK;TECHNOLOGY;COMPUTER SOFTWARE: PREPACKAGED SOFTWARE
258;MTB;M&T BANK CORPORATION COMMON STOCK;FINANCE;MAJOR BANKS
632;MTDR;MATADOR RESOURCES COMPANY COMMON STOCK;ENERGY;OIL & GAS PRODUCTION
594;MTG;MGIC INVESTMENT CORPORATION COMMON STOCK;FINANCE;PROPERTY-CASUALTY INSURERS
691;MTH;MERITAGE HOMES CORPORATION COMMON STOCK;CAPITAL GOODS;HOMEBUILDING
328;MTN;VAIL RESORTS INC. COMMON STOCK;CONSUMER SERVICES;MOVIES/ENTERTAINMENT
791;MTX;MINERALS TECHNOLOGIES INC. COMMON STOCK;BASIC INDUSTRIES;MAJOR CHEMICALS
441;MTZ;MASTEC INC. COMMON STOCK;BASIC INDUSTRIES;WATER SUPPLY
131;MU;MICRON TECHNOLOGY, INC.;;
659;MUR;MURPHY OIL CORPORATION COMMON STOCK;ENERGY;OIL & GAS PRODUCTION
689;MUSA;MURPHY USA INC. COMMON STOCK;PUBLIC UTILITIES;NATURAL GAS DISTRIBUTION
847;MWA;MUELLER WATER PRODUCTS COMMON STOCK;CAPITAL GOODS;OFFICE EQUIPMENT/SUPPLIES/SERVICES
739;MXL;MAXLINEAR INC. COMMON STOCK;TECHNOLOGY;SEMICONDUCTORS
870;MYOV;MYOVANT SCIENCES LTD. COMMON SHARES;HEALTH CARE;MAJOR PHARMACEUTICALS
833;NAC;NUVEEN CALIFORNIA QUALITY MUNICIPAL INCOME FUND;FINANCE;INVESTMENT MANAGERS
706;NAD;NUVEEN QUALITY MUNICIPAL INCOME FUND COMMON STOCK;FINANCE;INVESTMENT MANAGERS
132;NAPA;THE DUCKHORN PORTFOLIO, INC.;;
613;NAV;NAVISTAR INTERNATIONAL CORPORATION COMMON STOCK;CAPITAL GOODS;AUTO MANUFACTURING
133;NCLH;NORWEGIAN CRUISE LINE HOLDINGS LTD.;;
362;NCLH;NORWEGIAN CRUISE LINE HOLDINGS LTD. ORDINARY SHARES;TRANSPORTATION;MARINE TRANSPORTATION
521;NCR;NCR CORPORATION COMMON STOCK;MISCELLANEOUS;OFFICE EQUIPMENT/SUPPLIES/SERVICES
597;NEA;NUVEEN AMT-FREE QUALITY MUNICIPAL INCOME FUND COMMON SHARES OF BENEFICIAL INTEREST PAR VALUE $.01;FINANCE;FINANCE/INVESTORS SERVICES
134;NEE;NEXTERA ENERGY, INC.;;
35;NEE;NEXTERA ENERGY INC. COMMON STOCK;PUBLIC UTILITIES;ELECTRIC UTILITIES: CENTRAL
108;NEM;NEWMONT CORPORATION;BASIC INDUSTRIES;PRECIOUS METALS
135;NEM;NEWMONT CORPORATION;;
545;NEP;NEXTERA ENERGY PARTNERS LP COMMON UNITS REPRESENTING LIMITED PARTNER INTERESTS;PUBLIC UTILITIES;ELECTRIC UTILITIES: CENTRAL
136;NET;CLOUDFLARE, INC.;;
163;NET;CLOUDFLARE INC. CLASS A COMMON STOCK;TECHNOLOGY;EDP SERVICES
697;NEU;NEWMARKET CORP COMMON STOCK;BASIC INDUSTRIES;MAJOR CHEMICALS
611;NEWR;NEW RELIC INC. COMMON STOCK;TECHNOLOGY;COMPUTER SOFTWARE: PREPACKAGED SOFTWARE
590;NFG;NATIONAL FUEL GAS COMPANY COMMON STOCK;PUBLIC UTILITIES;OIL/GAS TRANSMISSION
734;NHI;NATIONAL HEALTH INVESTORS INC. COMMON STOCK;CONSUMER SERVICES;REAL ESTATE INVESTMENT TRUSTS
389;NI;NISOURCE INC COMMON STOCK;PUBLIC UTILITIES;POWER GENERATION
137;NIO;NIO INC.;;
654;NJR;NEWJERSEY RESOURCES CORPORATION COMMON STOCK;PUBLIC UTILITIES;OIL/GAS TRANSMISSION
16;NKE;NIKE INC. COMMON STOCK;CONSUMER NON-DURABLES;SHOE MANUFACTURING
138;NKE;NIKE, INC.;;
139;NKLA;NIKOLA CORPORATION;;
331;NLY;ANNALY CAPITAL MANAGEMENT INC COMMON STOCK;CONSUMER SERVICES;REAL ESTATE INVESTMENT TRUSTS
140;NLY;ANNALY CAPITAL MANAGEMENT, INC.;;
763;NNI;NELNET INC. COMMON STOCK;FINANCE;FINANCE: CONSUMER SERVICES
432;NNN;NATIONAL RETAIL PROPERTIES COMMON STOCK;CONSUMER SERVICES;REAL ESTATE INVESTMENT TRUSTS
93;NOC;NORTHROP GRUMMAN CORPORATION COMMON STOCK;CAPITAL GOODS;INDUSTRIAL MACHINERY/COMPONENTS
141;NOK;NOKIA CORPORATION;;
522;NOV;NOV INC. COMMON STOCK;ENERGY;METAL FABRICATIONS
657;NOVA;SUNNOVA ENERGY INTERNATIONAL INC. COMMON STOCK;PUBLIC UTILITIES;POWER GENERATION
52;NOW;SERVICENOW INC. COMMON STOCK;TECHNOLOGY;COMPUTER SOFTWARE: PREPACKAGED SOFTWARE
876;NPO;ENPRO INDUSTRIES INC;;
408;NRG;NRG ENERGY INC. COMMON STOCK;PUBLIC UTILITIES;ELECTRIC UTILITIES: CENTRAL
575;NRZ;NEW RESIDENTIAL INVESTMENT CORP. COMMON STOCK;CONSUMER SERVICES;REAL ESTATE INVESTMENT TRUSTS
878;NS;NUSTAR ENERGY L.P.  COMMON UNITS;;
84;NSC;NORFOLK SOUTHERN CORPORATION COMMON STOCK;TRANSPORTATION;RAILROADS
680;NSP;INSPERITY INC. COMMON STOCK;TECHNOLOGY;PROFESSIONAL SERVICES
