;Ticker;Name;Sector;Industry
863;WLL;WHITING PETROLEUM CORPORATION COMMON STOCK (NEW);ENERGY;OIL & GAS PRODUCTION
94;WM;WASTE MANAGEMENT INC. COMMON STOCK;PUBLIC UTILITIES;ENVIRONMENTAL SERVICES
162;WMB;WILLIAMS COMPANIES INC. (THE) COMMON STOCK;PUBLIC UTILITIES;NATURAL GAS DISTRIBUTION
211;WMB;THE WILLIAMS COMPANIES, INC.;;
443;WMS;ADVANCED DRAINAGE SYSTEMS INC. COMMON STOCK;CAPITAL GOODS;CONTAINERS/PACKAGING
3;WMT;WALMART INC. COMMON STOCK;CONSUMER SERVICES;DEPARTMENT/SPECIALTY RETAIL STORES
212;WMT;WALMART INC.;;
727;WOR;WORTHINGTON INDUSTRIES INC. COMMON STOCK;CONSUMER DURABLES;AEROSPACE
316;WPC;W. P. CAREY INC. REIT;CONSUMER SERVICES;REAL ESTATE INVESTMENT TRUSTS
327;WRB;W.R. BERKLEY CORPORATION COMMON STOCK;FINANCE;PROPERTY-CASUALTY INSURERS
646;WRI;WEINGARTEN REALTY INVESTORS COMMON STOCK;CONSUMER SERVICES;REAL ESTATE INVESTMENT TRUSTS
351;WSM;WILLIAMS-SONOMA INC. COMMON STOCK (DE);CONSUMER SERVICES;OTHER SPECIALTY STORES
365;WSO;WATSCO INC. COMMON STOCK;CAPITAL GOODS;WHOLESALE DISTRIBUTORS
200;WST;WEST PHARMACEUTICAL SERVICES INC. COMMON STOCK;HEALTH CARE;MEDICAL/DENTAL INSTRUMENTS
694;WTM;WHITE MOUNTAINS INSURANCE GROUP LTD. COMMON STOCK;FINANCE;PROPERTY-CASUALTY INSURERS
361;WTRG;ESSENTIAL UTILITIES INC. COMMON STOCK;PUBLIC UTILITIES;WATER SUPPLY
591;WTS;WATTS WATER TECHNOLOGIES INC. CLASS A COMMON STOCK;CAPITAL GOODS;OFFICE EQUIPMENT/SUPPLIES/SERVICES
397;WU;WESTERN UNION COMPANY (THE) COMMON STOCK;MISCELLANEOUS;BUSINESS SERVICES
610;WWE;WORLD WRESTLING ENTERTAINMENT INC. CLASS A COMMON STOCK;CONSUMER SERVICES;MOVIES/ENTERTAINMENT
781;WWW;WOLVERINE WORLD WIDE INC. COMMON STOCK;CONSUMER NON-DURABLES;SHOE MANUFACTURING
205;WY;WEYERHAEUSER COMPANY COMMON STOCK;CONSUMER SERVICES;REAL ESTATE INVESTMENT TRUSTS
213;X;UNITED STATES STEEL CORPORATION;;
494;X;UNITED STATES STEEL CORPORATION COMMON STOCK;BASIC INDUSTRIES;STEEL/IRON ORE
464;XEC;CIMAREX ENERGY CO COMMON STOCK;ENERGY;OIL & GAS PRODUCTION
214;XEL;XCEL ENERGY INC.;;
844;XHR;XENIA HOTELS & RESORTS INC. COMMON STOCK;CONSUMER SERVICES;REAL ESTATE INVESTMENT TRUSTS
10;XOM;EXXON MOBIL CORPORATION COMMON STOCK;ENERGY;INTEGRATED OIL COMPANIES
215;XOM;EXXON MOBIL CORPORATION;;
216;XP;XP INC.;;
217;XPEV;XPENG INC.;;
284;XPO;XPO LOGISTICS INC.;TRANSPORTATION;OIL REFINING/MARKETING
605;XRX;XEROX HOLDINGS CORPORATION COMMON STOCK;TECHNOLOGY;EDP SERVICES
232;XYL;XYLEM INC. COMMON STOCK NEW;CAPITAL GOODS;FLUID CONTROLS
403;Y;ALLEGHANY CORPORATION COMMON STOCK;FINANCE;PROPERTY-CASUALTY INSURERS
749;YELP;YELP INC. COMMON STOCK;TECHNOLOGY;INTERNET AND INFORMATION SERVICES
448;YETI;YETI HOLDINGS INC. COMMON STOCK;CONSUMER SERVICES;MOVIES/ENTERTAINMENT
151;YUM;YUM! BRANDS INC.;CONSUMER SERVICES;RESTAURANTS
188;YUMC;YUM CHINA HOLDINGS INC. COMMON STOCK;CONSUMER SERVICES;RESTAURANTS
155;ZBH;ZIMMER BIOMET HOLDINGS INC. COMMON STOCK;HEALTH CARE;INDUSTRIAL SPECIALTIES
218;ZNGA;ZYNGA INC.;;
60;ZTS;ZOETIS INC. CLASS A COMMON STOCK;HEALTH CARE;MAJOR PHARMACEUTICALS
